{
  "generatedAt": "2026-02-21T03:51:33.574Z",
  "template": "kpmg-diligence",
  "valid": true,
  "errors": [],
  "warnings": [
    "Repeated body line appears on 26 slides: \"Diligence focus: confirm revenue sustainability, backlog conversion, and pricing disc...\"",
    "Repeated body line appears on 26 slides: \"Validate margin trajectory, mix shift, and inventory provisioning methodology.\"",
    "Repeated body line appears on 26 slides: \"Assess customer concentration, renewal cadence, and contract terms for key accounts.\"",
    "Repeated body line appears on 26 slides: \"Quantify working capital impacts from lead times, supply commitments, and buffer stock.\"",
    "Repeated body line appears on 26 slides: \"Stress-test downside scenarios tied to hyperscaler capex cycles and platform transiti...\""
  ],
  "densityFindings": [
    {
      "slideIndex": 0,
      "slideType": "cover",
      "status": "OK",
      "score": 1,
      "minScore": 0.65,
      "acceptableFloor": 0.552,
      "shouldRepair": false
    },
    {
      "slideIndex": 1,
      "slideType": "divider",
      "status": "OK",
      "score": 1,
      "minScore": 0.75,
      "acceptableFloor": 0.637,
      "shouldRepair": false
    },
    {
      "slideIndex": 2,
      "slideType": "analysisNarrowTable",
      "status": "OK",
      "score": 1,
      "minScore": 0.72,
      "acceptableFloor": 0.612,
      "shouldRepair": false
    },
    {
      "slideIndex": 3,
      "slideType": "analysisWideChart2ColsText",
      "status": "OK",
      "score": 1,
      "minScore": 0.75,
      "acceptableFloor": 0.637,
      "shouldRepair": false
    },
    {
      "slideIndex": 4,
      "slideType": "analysisWideChart2ColsText",
      "status": "OK",
      "score": 1,
      "minScore": 0.75,
      "acceptableFloor": 0.637,
      "shouldRepair": false
    },
    {
      "slideIndex": 5,
      "slideType": "analysisNarrowTable",
      "status": "OK",
      "score": 1,
      "minScore": 0.72,
      "acceptableFloor": 0.612,
      "shouldRepair": false
    },
    {
      "slideIndex": 6,
      "slideType": "analysisNarrowTable",
      "status": "OK",
      "score": 1,
      "minScore": 0.72,
      "acceptableFloor": 0.612,
      "shouldRepair": false
    },
    {
      "slideIndex": 7,
      "slideType": "divider",
      "status": "OK",
      "score": 1,
      "minScore": 0.75,
      "acceptableFloor": 0.637,
      "shouldRepair": false
    },
    {
      "slideIndex": 8,
      "slideType": "analysisNarrowTable",
      "status": "OK",
      "score": 1,
      "minScore": 0.72,
      "acceptableFloor": 0.612,
      "shouldRepair": false
    },
    {
      "slideIndex": 9,
      "slideType": "analysisWideChart2ColsText",
      "status": "OK",
      "score": 1,
      "minScore": 0.75,
      "acceptableFloor": 0.637,
      "shouldRepair": false
    },
    {
      "slideIndex": 10,
      "slideType": "analysisWideChartTableText",
      "status": "OK",
      "score": 1,
      "minScore": 0.75,
      "acceptableFloor": 0.637,
      "shouldRepair": false
    },
    {
      "slideIndex": 11,
      "slideType": "analysisWideChartTableText",
      "status": "OK",
      "score": 1,
      "minScore": 0.75,
      "acceptableFloor": 0.637,
      "shouldRepair": false
    },
    {
      "slideIndex": 12,
      "slideType": "analysisWideChartTableText",
      "status": "OK",
      "score": 1,
      "minScore": 0.75,
      "acceptableFloor": 0.637,
      "shouldRepair": false
    },
    {
      "slideIndex": 13,
      "slideType": "divider",
      "status": "OK",
      "score": 1,
      "minScore": 0.75,
      "acceptableFloor": 0.637,
      "shouldRepair": false
    },
    {
      "slideIndex": 14,
      "slideType": "analysisWideChart2ColsText",
      "status": "OK",
      "score": 1,
      "minScore": 0.75,
      "acceptableFloor": 0.637,
      "shouldRepair": false
    },
    {
      "slideIndex": 15,
      "slideType": "analysisNarrowTable",
      "status": "OK",
      "score": 1,
      "minScore": 0.72,
      "acceptableFloor": 0.612,
      "shouldRepair": false
    },
    {
      "slideIndex": 16,
      "slideType": "analysisWideChart2ColsText",
      "status": "OK",
      "score": 1,
      "minScore": 0.75,
      "acceptableFloor": 0.637,
      "shouldRepair": false
    },
    {
      "slideIndex": 17,
      "slideType": "analysisWideChart2ColsText",
      "status": "OK",
      "score": 1,
      "minScore": 0.75,
      "acceptableFloor": 0.637,
      "shouldRepair": false
    },
    {
      "slideIndex": 18,
      "slideType": "analysisWideChartTableText",
      "status": "OK",
      "score": 1,
      "minScore": 0.75,
      "acceptableFloor": 0.637,
      "shouldRepair": false
    },
    {
      "slideIndex": 19,
      "slideType": "analysisWideChartTableText",
      "status": "OK",
      "score": 1,
      "minScore": 0.75,
      "acceptableFloor": 0.637,
      "shouldRepair": false
    },
    {
      "slideIndex": 20,
      "slideType": "analysisWideChartTableText",
      "status": "OK",
      "score": 1,
      "minScore": 0.75,
      "acceptableFloor": 0.637,
      "shouldRepair": false
    },
    {
      "slideIndex": 21,
      "slideType": "divider",
      "status": "OK",
      "score": 1,
      "minScore": 0.75,
      "acceptableFloor": 0.637,
      "shouldRepair": false
    },
    {
      "slideIndex": 22,
      "slideType": "analysisWideChart2ColsText",
      "status": "OK",
      "score": 1,
      "minScore": 0.75,
      "acceptableFloor": 0.637,
      "shouldRepair": false
    },
    {
      "slideIndex": 23,
      "slideType": "analysisWideChartTableText",
      "status": "OK",
      "score": 1,
      "minScore": 0.75,
      "acceptableFloor": 0.637,
      "shouldRepair": false
    },
    {
      "slideIndex": 24,
      "slideType": "analysisWideChart2ColsText",
      "status": "OK",
      "score": 1,
      "minScore": 0.75,
      "acceptableFloor": 0.637,
      "shouldRepair": false
    },
    {
      "slideIndex": 25,
      "slideType": "analysisWideChartTableText",
      "status": "OK",
      "score": 1,
      "minScore": 0.75,
      "acceptableFloor": 0.637,
      "shouldRepair": false
    },
    {
      "slideIndex": 26,
      "slideType": "analysisWideChartTableText",
      "status": "OK",
      "score": 1,
      "minScore": 0.75,
      "acceptableFloor": 0.637,
      "shouldRepair": false
    },
    {
      "slideIndex": 27,
      "slideType": "divider",
      "status": "OK",
      "score": 1,
      "minScore": 0.75,
      "acceptableFloor": 0.637,
      "shouldRepair": false
    },
    {
      "slideIndex": 28,
      "slideType": "analysisWideChart2ColsText",
      "status": "OK",
      "score": 1,
      "minScore": 0.75,
      "acceptableFloor": 0.637,
      "shouldRepair": false
    },
    {
      "slideIndex": 29,
      "slideType": "analysisWideChart2ColsText",
      "status": "OK",
      "score": 1,
      "minScore": 0.75,
      "acceptableFloor": 0.637,
      "shouldRepair": false
    },
    {
      "slideIndex": 30,
      "slideType": "analysisWideChart2ColsText",
      "status": "OK",
      "score": 1,
      "minScore": 0.75,
      "acceptableFloor": 0.637,
      "shouldRepair": false
    },
    {
      "slideIndex": 31,
      "slideType": "analysisWideChart2ColsText",
      "status": "OK",
      "score": 1,
      "minScore": 0.75,
      "acceptableFloor": 0.637,
      "shouldRepair": false
    },
    {
      "slideIndex": 32,
      "slideType": "analysisWideChart2ColsText",
      "status": "OK",
      "score": 1,
      "minScore": 0.75,
      "acceptableFloor": 0.637,
      "shouldRepair": false
    },
    {
      "slideIndex": 33,
      "slideType": "analysisNarrowTable",
      "status": "OK",
      "score": 1,
      "minScore": 0.72,
      "acceptableFloor": 0.612,
      "shouldRepair": false
    },
    {
      "slideIndex": 34,
      "slideType": "analysisWideChart2ColsText",
      "status": "OK",
      "score": 1,
      "minScore": 0.75,
      "acceptableFloor": 0.637,
      "shouldRepair": false
    },
    {
      "slideIndex": 35,
      "slideType": "analysisWideChartTableText",
      "status": "OK",
      "score": 1,
      "minScore": 0.75,
      "acceptableFloor": 0.637,
      "shouldRepair": false
    },
    {
      "slideIndex": 36,
      "slideType": "titleStrapline4TextBoxes",
      "status": "OK",
      "score": 1,
      "minScore": 0.75,
      "acceptableFloor": 0.637,
      "shouldRepair": false
    },
    {
      "slideIndex": 37,
      "slideType": "backCover",
      "status": "OK",
      "score": 1,
      "minScore": 0,
      "acceptableFloor": 1,
      "shouldRepair": false
    },
    {
      "slideIndex": 38,
      "slideType": "analysisWideChart2ColsText",
      "status": "OK",
      "score": 1,
      "minScore": 0.75,
      "acceptableFloor": 0.637,
      "shouldRepair": false
    },
    {
      "slideIndex": 39,
      "slideType": "analysisWideChartTableText",
      "status": "OK",
      "score": 1,
      "minScore": 0.75,
      "acceptableFloor": 0.637,
      "shouldRepair": false
    }
  ],
  "densitySummary": {
    "ok": 40,
    "thin": 0,
    "sparse": 0
  },
  "missingSlots": [],
  "thinSlides": [],
  "sparseSlides": [],
  "slotIssues": [
    {
      "slideIndex": 37,
      "slideType": "backCover",
      "slot": "disclaimer",
      "kind": "text",
      "code": "below_target",
      "message": "disclaimer is below density target (0 < 80)",
      "severity": "warning",
      "actual": 0,
      "target": 80,
      "hook": "addBullets",
      "suggestedRemedy": "Add bullets or paragraph text to reach the minimum content density."
    },
    {
      "slideIndex": 37,
      "slideType": "backCover",
      "slot": "url",
      "kind": "text",
      "code": "below_target",
      "message": "url is below density target (0 < 5)",
      "severity": "warning",
      "actual": 0,
      "target": 5,
      "hook": "addBullets",
      "suggestedRemedy": "Add bullets or paragraph text to reach the minimum content density."
    }